{"$schema":"https://json-schema.org/draft/2020-12/schema","$defs":{"#ActivityEntry":{"anyOf":[{"$ref":"#/$defs/%23EventActivity"},{"$ref":"#/$defs/%23NoteActivity"}]},"#Affordance":{"type":"object","additionalProperties":false,"properties":{"capability":{"$ref":"#/$defs/%23EntityCapability"},"command":{"$ref":"#/$defs/%23Identifier"}},"required":["capability","command"]},"#Attribute":{"type":"object","additionalProperties":false,"properties":{"key":{"$ref":"#/$defs/%23Identifier"},"label":{"type":"string","maxLength":128,"minLength":1},"value":{"type":"string","maxLength":4096,"minLength":1}},"required":["key","label","value"]},"#EntityCapability":{"type":"string","pattern":"^[a-z][A-Za-z0-9._:-]*$"},"#EventActivity":{"type":"object","additionalProperties":false,"properties":{"activity_id":{"$ref":"#/$defs/%23Identifier"},"activity_type":{"type":"string","pattern":"^[a-z][a-z0-9-]*\\.[A-Za-z0-9][A-Za-z0-9._:-]*$"},"actor":{"type":"string","maxLength":256,"minLength":1},"body":{"type":"string","maxLength":16384,"minLength":1},"kind":{"const":"event"},"occurred_at":{"$ref":"#/$defs/%23Timestamp"},"summary":{"type":"string","maxLength":512,"minLength":1}},"required":["activity_id","activity_type","kind","occurred_at","summary"]},"#Identifier":{"type":"string","pattern":"^[A-Za-z0-9][A-Za-z0-9._:-]*$"},"#NoteActivity":{"type":"object","additionalProperties":false,"properties":{"activity_id":{"$ref":"#/$defs/%23Identifier"},"activity_type":{"type":"string","pattern":"^[a-z][a-z0-9-]*\\.[A-Za-z0-9][A-Za-z0-9._:-]*$"},"actor":{"type":"string","maxLength":256,"minLength":1},"affordances":{"type":"array","items":{"$ref":"#/$defs/%23Affordance"}},"body":{"type":"string","maxLength":16384,"minLength":1},"kind":{"const":"note"},"occurred_at":{"$ref":"#/$defs/%23Timestamp"},"revision":{"type":"string","maxLength":128,"minLength":1},"source":{"$ref":"#/$defs/%23SourceRef"},"state":{"enum":["active","inactive"]},"summary":{"type":"string","maxLength":512,"minLength":1}},"required":["activity_id","activity_type","actor","affordances","body","kind","occurred_at","revision","source","state","summary"]},"#SourceRef":{"type":"object","additionalProperties":false,"properties":{"entity_id":{"$ref":"#/$defs/%23Identifier"},"entity_type":{"$ref":"#/$defs/%23Identifier"},"plugin_id":{"type":"string","pattern":"^[a-z][a-z0-9-]*$"}},"required":["entity_id","entity_type","plugin_id"]},"#Timestamp":{"type":"string","pattern":"^[0-9]{4}-[0-9]{2}-[0-9]{2}T"}},"type":"object","additionalProperties":false,"properties":{"activity":{"type":"array","items":{"$ref":"#/$defs/%23ActivityEntry"}},"affordances":{"type":"array","items":{"$ref":"#/$defs/%23Affordance"}},"attributes":{"type":"array","items":{"$ref":"#/$defs/%23Attribute"}},"description":{"type":"string","maxLength":16384,"minLength":1},"revision":{"type":"string","maxLength":256,"minLength":1},"schema_version":{"const":"mission-control.entity-detail/v1"},"source":{"$ref":"#/$defs/%23SourceRef"},"state":{"type":"string","maxLength":128,"minLength":1},"title":{"type":"string","maxLength":256,"minLength":1}},"required":["activity","affordances","attributes","schema_version","source","title"]}
